{
  "schema": "sley.self_hosting.status.v0",
  "status": "bootstrap",
  "strict_self_hosted": false,
  "source_root": "self-hosted/src",
  "semantic_source_count": 6,
  "source_modules": [
    "loom.bootstrap",
    "loom.checker",
    "loom.lint",
    "loom.parser",
    "loom.reports",
    "loom.runtime"
  ],
  "bootstrap_owned_by_sley": [
    "implementation_version",
    "implementation_stage",
    "self_hosting_status",
    "strict_self_hosted",
    "source_modules",
    "default_lint_rules",
    "core_report_schema_ids",
    "diagnostic_ids",
    "runtime_seed_values",
    "parser_expression_classifiers",
    "parser_statement_and_binding_kinds",
    "bootstrap_smoke_runtime",
    "bootstrap_smoke_task_execution",
    "checker_diagnostic_status",
    "checker_status_task_execution",
    "checker_builtin_type_task_execution",
    "checker_unknown_type_diagnostics",
    "checker_identifier_resolution_inputs",
    "lint_status_task_execution",
    "lint_finding_messages",
    "runtime_status_task_execution",
    "pure_literal_runtime_execution",
    "bool_literal_runtime_execution",
    "seeded_agent_deploy_task_execution",
    "project_ready_task_execution",
    "ast_runtime_probe_dispatch",
    "self_hosting_report_shape",
    "runtime_report_status_and_dispatch"
  ],
  "blockers": [
    "execute parser semantics from Sley source",
    "execute checker semantics from Sley source",
    "execute runtime semantics from Sley source",
    "replace shell JSON shaping with Sley-owned report builders",
    "prove parity against public fixtures and command manifests"
  ]
}
